{
  "schemaVersion": 1,
  "taskCode": "sltb_lab_decision_v1",
  "meta": {
    "title": "Lab Testing Decision",
    "description": "Determine whether laboratory testing is required for the submitted tea sample."
  },
  "forms": {
    "review": "sltb-lab-decision--officer-form"
  },
  "behavior": {
    "type": "statusMap",
    "outcomeField": "lab_testing_required",
    "statusMap": {
      "yes": "APPROVED",
      "no": "APPROVED"
    }
  },
  "permissions": [
    {
      "role": "officer",
      "actions": [
        "VIEW",
        "REVIEW",
        "FEEDBACK"
      ]
    }
  ]
}
