{
  "schemaVersion": 1,
  "taskCode": "npqs_treatment_review_v1",
  "meta": {
    "title": "NPQS Review Treatment Certificates",
    "description": "Officer reviews the uploaded/issued treatment certificates."
  },
  "forms": {
    "view": "npqs-apply-phyto-cert--user-form",
    "review": "npqs-review-treatment-certs--officer-form"
  },
  "behavior": {
    "type": "statusMap",
    "outcomeField": "treatment_review_result",
    "statusMap": {
      "pass": "APPROVED",
      "needs_more_info": "FEEDBACK_REQUESTED"
    }
  },
  "permissions": [
    {
      "role": "officer",
      "actions": [
        "VIEW",
        "REVIEW",
        "FEEDBACK"
      ]
    }
  ]
}
